participant_id,displayCondition,socialCondition,dimensionOrder,displayOrder,experiment_phase,response,rankOrder,orderedRanks
38,integrated,operator,"Speed,Direction,Status,Craft,Role","4,1,0,3,2",verbal_report_textbox_phase3,the status was the first thing i monitored before others followed,"Status,Role,Direction,Craft","1,2,3,4"
39,integrated,operator,"Direction,Status,Role,Craft,Speed","0,4,1,2,3",verbal_report_textbox_phase2,most important thing for me was speed and direction,"Craft,Role,Status,Direction,Speed","3,3,3,4,5"
39,integrated,operator,"Direction,Status,Role,Craft,Speed","0,4,1,2,3",verbal_report_textbox_phase3,i realized a lot of things was important. before my every choice i was looking at dmg status twice,"Direction,Craft,Speed,Role,Status","3,4,4,5,5"
40,integrated,superior,"Craft,Speed,Status,Role,Direction","4,1,3,0,2",verbal_report_textbox_phase2,"In the training phase, it seemed completely to be dependant on whether the craft was an aeroplane or submarine, if I remember correctly all the submarines were hostile and all of the aeroplanes were friendly. This was the logic I used in the task.","Craft,Role,Status,Speed,Direction","1,5,5,5,5"
40,integrated,superior,"Craft,Speed,Status,Role,Direction","4,1,3,0,2",verbal_report_textbox_phase3,"Once the information as to whether it was an aeroplane or submarine was removed things became very confused as this was all I was using to determine the hostility of the craft, meaning I  was now mostly guessing. However, it seemed that the role changed position in the box (it was higher or lower), I thought that when the role was placed lower in the box this might mean that the craft was a submarine (enemy) and when the role was higher this might mean that the craft was an aeroplane (friendly). I am unsure as to whether there is any logic to this, probably not, to be honest, I was completely lost after the type of craft became hidden.","Role,Craft,Status,Speed,Direction","1,5,5,5,5"
41,integrated,superior,"Direction,Status,Role,Speed,Craft","4,2,0,1,3",verbal_report_textbox_phase2,"Generally focusing on direction and heading, and then on whether it was damaged or un damaged. If it was heading left, hostile, and right, friendly. generally was the rule with only a few differences/errors","Direction,Role,Speed,Status,Craft","1,2,2,3,4"
41,integrated,superior,"Direction,Status,Role,Speed,Craft","4,2,0,1,3",verbal_report_textbox_phase3,"I went off the damage report. if it was damaged, chances are it was friendly, and if undamaged, it was more than likely a hostile","Direction,Speed,Status,Craft,Role","1,2,3,4,5"
42,integrated,superior,"Craft,Speed,Status,Direction,Role","4,3,0,1,2",verbal_report_textbox_phase2,"I had more results, which specified, that friendly aircrafts are far more common than friendly submarines. ","Craft,Direction,Role,Status,Speed","1,2,3,3,4"
42,integrated,superior,"Craft,Speed,Status,Direction,Role","4,3,0,1,2",verbal_report_textbox_phase3,"I had much more difficulty in choosing, since I wasn't given the main factor of whether the craft is an airplane or a submarine.","Craft,Role,Status,Speed,Direction","1,3,3,3,3"
43,integrated,superior,"Role,Status,Craft,Speed,Direction","1,3,2,4,0",verbal_report_textbox_phase2,mainly based on the damage status,"Status,Speed,Craft,Role,Direction","1,2,3,3,5"
43,integrated,superior,"Role,Status,Craft,Speed,Direction","1,3,2,4,0",verbal_report_textbox_phase3,the rate of the speed helped me determine,"Status,Speed,Role,Craft,Direction","1,1,2,3,5"
44,integrated,superior,"Direction,Role,Speed,Craft,Status","1,0,3,2,4",verbal_report_textbox_phase2,I mainly looked at the speed and direction. I think faster speed crafts tend to be hostile especially if they are moving right.,"Speed,Craft,Direction,Status,Role","1,2,3,4,5"
44,integrated,superior,"Direction,Role,Speed,Craft,Status","1,0,3,2,4",verbal_report_textbox_phase3,Without speed indicator I was completely lost and I made my decision based mainly on the direction. I also considered the status of the craft.,"Direction,Status,Craft,Role,Speed","1,2,3,4,5"
45,integrated,superior,"Craft,Speed,Role,Direction,Status","2,3,0,4,1",verbal_report_textbox_phase2,"I thought that most aircrafts were friendly and most submarines were hostiles. I also thought that decoys were usually slightly more likely to be hostile than automated ones, and also that undamaged crafts were more likely to be friendly, but I was never really confident about any of these judgments.","Craft,Role,Speed,Status,Direction","1,2,3,4,5"
45,integrated,superior,"Craft,Speed,Role,Direction,Status","2,3,0,4,1",verbal_report_textbox_phase3,"I thought that faster, damaged and decoy crafts were more likely to be hostile. I also thought that crafts going to the left were more likely to be hostile, but I had little idea at this point.","Role,Speed,Status,Direction,Craft","1,2,3,4,5"
46,integrated,superior,"Direction,Craft,Speed,Role,Status","1,0,4,3,2",verbal_report_textbox_phase2,hostile: damaged and fast or only fast\nfriendly: undamaged and slow ,"Status,Speed,Craft,Role,Direction","1,1,3,4,5"
46,integrated,superior,"Direction,Craft,Speed,Role,Status","1,0,4,3,2",verbal_report_textbox_phase3,hostile: damaged and fast or only fast or damaged and slow\nfriendly: undamaged and slow \n,"Status,Speed,Role,Craft,Direction","1,1,3,5,5"
47,integrated,superior,"Status,Speed,Role,Craft,Direction","0,4,3,1,2",verbal_report_textbox_phase2,I chose the friendly units to be the fastest and not to be damaged,"Direction,Role,Status,Craft,Speed","2,3,4,5,5"
47,integrated,superior,"Status,Speed,Role,Craft,Direction","0,4,3,1,2",verbal_report_textbox_phase3,I chose the decoy units to be set to the left and the main ones to the right,"Role,Status,Craft,Speed,Direction","3,3,4,4,5"
48,integrated,superior,"Craft,Role,Speed,Status,Direction","0,3,4,1,2",verbal_report_textbox_phase2,I found that during phase one I couldn't quite find a pattern which was 100% accurate when I tried to focus on what made a craft friendly or hostile. However I did find that if it was a plane it was much more likely to be hostile and if it was a submarine then it was much more likely to be friendly so this is how I decided how to class them in the previous task.,"Craft,Status,Speed,Direction,Role","1,2,3,4,5"
48,integrated,superior,"Craft,Role,Speed,Status,Direction","0,3,4,1,2",verbal_report_textbox_phase3,In this task I found that what I was previously relying upon was no longer there (plane or submarine) so I soon decided that if I cannot know all the information then I simply have to treat each craft as a hostile as it is better to be safe than sorry. ,"Craft,Status,Speed,Direction,Role","1,2,3,4,5"
49,integrated,superior,"Direction,Craft,Role,Speed,Status","0,1,4,2,3",verbal_report_textbox_phase2,By reading the instructions and imagin the craft movement according to the information i was given.,"Role,Direction,Craft,Status,Speed","1,2,3,4,5"
49,integrated,superior,"Direction,Craft,Role,Speed,Status","0,1,4,2,3",verbal_report_textbox_phase3,Try and understand by the information i was given if the craft is hostile or friendly. ,"Status,Craft,Speed,Direction,Role","1,2,3,4,5"
50,integrated,superior,"Speed,Role,Direction,Status,Craft","2,1,3,4,0",verbal_report_textbox_phase2,If the direction was left and the line was long then the craft was friendly. If the direction was left and the line was short then the craft was hostile. If the direction was right and the line was long then the craft was hostile. If the direction was right and the line was short then the craft was friendly. I only realised the length of the line mattered towards the end of the training though and didn't have time to really check whether I had the interpretations the right way for all 4 scenarios.,"Direction,Speed,Status,Craft,Role","1,2,3,4,5"
50,integrated,superior,"Speed,Role,Direction,Status,Craft","2,1,3,4,0",verbal_report_textbox_phase3,I didn't think that there was any way to tell whether the craft was friendly or hostile in this task because the direction was missing.,"Direction,Status,Craft,Speed,Role","1,2,3,4,5"
51,integrated,superior,"Status,Role,Direction,Craft,Speed","4,0,3,1,2",verbal_report_textbox_phase2,"if the plane was autonomous and was fast, i considered it hostile. If the plane was a decoy I would consider it friendly. In the submarine, if he was autonomous, he was friendly, if he was a decoy he considered him hostile. ","Role,Craft,Speed,Status,Direction","1,2,3,4,5"
51,integrated,superior,"Status,Role,Direction,Craft,Speed","4,0,3,1,2",verbal_report_textbox_phase3,"In this exercise I tried to use the damage logic, if there was a lot of damage and it was decoy and plane, then it was hostile, if it was not it was autonomous. If it had little damage, and it was a submarine and it was decoy then it was hostile","Craft,Role,Status,Speed,Direction","1,2,3,4,5"
52,integrated,superior,"Role,Speed,Craft,Direction,Status","0,2,3,1,4",verbal_report_textbox_phase2,"I was trying to decide if its dangerous or not and in which way it goes, and the tipe of craft it is, and if it is slow or fast","Status,Speed,Role,Craft,Direction","1,2,3,4,5"
52,integrated,superior,"Role,Speed,Craft,Direction,Status","0,2,3,1,4",verbal_report_textbox_phase3,I was deciding on base if this a decoy or not,"Role,Status,Direction,Speed,Craft","1,2,3,4,5"
53,integrated,superior,"Direction,Speed,Craft,Status,Role","1,4,2,3,0",verbal_report_textbox_phase2,"I associated the speed as indication if the craft was in combat or not and the direction as the sides of battle. If, for example, there was an undamaged craft travelling at full speed to the left side (which I took as my own out of habit), it meant that tthis craft was hostile. ","Speed,Direction,Craft,Status,Role","1,2,4,4,5"
53,integrated,superior,"Direction,Speed,Craft,Status,Role","1,4,2,3,0",verbal_report_textbox_phase3,"Same as earlier, but I've changed my mind concerning the direction of the craft, because there was no perspective applied. The more I think of it, the less sense it makes - it's really hard to translate these combinations of symbols to an imaginary naval battle (either hostile or friendly crafts can take different directions, be damaged or undamaged, adjust different speeds)","Craft,Speed,Status,Role,Direction","2,2,4,5,5"
54,integrated,superior,"Speed,Craft,Role,Status,Direction","4,1,0,2,3",verbal_report_textbox_phase2,"I have to say that while I thought I had some sort of system I got confused half way through the task and started questioning every choice. I thought that if the craft is autonomous, travels at a low speed and is undamaged it's more likely to be friendly. If the craft travels to the left at a high speed while being a decoy I thought that it's most likely to be a hostile. I didn't really take the type of craft (submarine or airplane) into consideration throughout the task.\nFor some reason I trusted that the damaged craft that is travelling to the left is more likely to be friendly. ","Role,Speed,Direction,Status,Craft","1,2,3,4,5"
54,integrated,superior,"Speed,Craft,Role,Status,Direction","4,1,0,2,3",verbal_report_textbox_phase3,"Without being able to tell whether a craft is autonomous or a decoy I was very confused. I decided, I'm not sure why that a craft is most likely to be friendly when it's either approaching to the left while damaged at a slow speed or when it's going to the right, undamaged at any speed. Otherwise it was hostile.","Speed,Status,Direction,Craft,Role","1,2,3,4,5"
55,integrated,superior,"Role,Speed,Status,Craft,Direction","1,4,3,2,0",verbal_report_textbox_phase2,"When the craft tagged as a decoy was slow I decided it to be hostile, or when some autonomous crafts were fast and damaged.\nWhen the autonomous craft was slow and undamaged I thought about it as friendly, because why should it be hostile when probably there was no fight with others and comes with good intentions. The directions were not that important","Role,Speed,Status,Craft,Direction","1,2,3,4,5"
55,integrated,superior,"Role,Speed,Status,Craft,Direction","1,4,3,2,0",verbal_report_textbox_phase3,"Since there we no speed shown, it was a lot harder than before. I focused more on whether the craft was a decoy or not and whether it was damaged.\nDecoy and damaged = trap, so hostile\nAutonomous and undamaged = probably friendly","Role,Status,Speed,Direction,Craft","1,2,3,4,5"
56,integrated,superior,"Speed,Direction,Craft,Role,Status","0,3,4,2,1",verbal_report_textbox_phase2,"First of all, I was paying attention to whether the craft was damaged or not. If so, I was convinced that it is a friendly craft. Second, I was looking at whether the craft was autonomous or decoy. Third, I was looking at how fast craft moves and I was trying to guess what is the purpose of such fast/slow movement. Finally, I looked at the craft's move direction and I was analyzing it. ","Status,Role,Speed,Direction,Craft","1,2,3,4,5"
56,integrated,superior,"Speed,Direction,Craft,Role,Status","0,3,4,2,1",verbal_report_textbox_phase3,"Mainly, I was looking at the speed of the craft and wondering why it is moving so fast / slow in that direction. ","Status,Speed,Direction,Role,Craft","1,2,3,4,5"
57,integrated,superior,"Direction,Speed,Craft,Status,Role","2,0,4,1,3",verbal_report_textbox_phase2,"I attempted to rate each craft on it's own merit while calculating that aircraft could be expected to travel faster than their water based counterparts. Added to this was the fact that I expected the allies to be the better combatants and as such the damaged craft would automatically be weighted towards being hostile. I do admit though, there was a strong element of guesswork. That's not to say I wasn't confident with my guesses, when reporting to an officer confidence is always needed.","Direction,Speed,Craft,Status,Role","1,2,3,4,5"
57,integrated,superior,"Direction,Speed,Craft,Status,Role","2,0,4,1,3",verbal_report_textbox_phase3,With not knowing the status of the craft I was held to gauging their state of repair entirely by comparing their current speed to their assumed speed when they set off. With this test I felt I was far far worse at evaluating the vessels. With no pointers I tried to use their direction as a last resort.,"Speed,Direction,Role,Craft,Status","1,2,3,4,5"
58,integrated,superior,"Status,Craft,Speed,Role,Direction","3,1,0,4,2",verbal_report_textbox_phase2,There was sometimes too much information but clearly it helped to decide if friendly or hostile.,"Role,Direction,Status,Craft,Speed","2,3,4,5,5"
58,integrated,superior,"Status,Craft,Speed,Role,Direction","3,1,0,4,2",verbal_report_textbox_phase3,"This time, it was actually quite difficult and I believe due of my mistakes a lot of friendly vessels are sunk.","Role,Speed,Status,Direction,Craft","3,3,4,4,5"
59,integrated,superior,"Role,Craft,Speed,Direction,Status","1,4,0,2,3",verbal_report_textbox_phase2,"I was considering first the role of the craft: if the craft was autonomous, it could be friendly. After that, i considered the speed (high speed = hostile, low speed = maybe friendly) and if the craft was undamaged or damaged.","Role,Speed,Status,Direction,Craft","1,2,3,4,5"
59,integrated,superior,"Role,Craft,Speed,Direction,Status","1,4,0,2,3",verbal_report_textbox_phase3,"First I looked at the speed (high speed = probably hostile) and at the direction (right = maybe hostile). If the craft was undamaged, it could be hostile","Speed,Direction,Status,Craft,Role","1,2,3,4,5"
60,integrated,superior,"Status,Direction,Role,Speed,Craft","2,0,3,4,1",verbal_report_textbox_phase2,"Mainly based on the status and the direction, with trial and error style from the first part\n","Status,Direction,Role,Speed,Craft","1,2,3,4,5"
60,integrated,superior,"Status,Direction,Role,Speed,Craft","2,0,3,4,1",verbal_report_textbox_phase3,Mainly based on the status and the autonomous/decoy mode,"Status,Role,Speed,Craft,Direction","1,2,3,4,5"
61,integrated,superior,"Direction,Speed,Role,Craft,Status","0,2,1,4,3",verbal_report_textbox_phase2,"Hostile;\nAutonomous, Damaged, Fast\nDecoy, Damaged, Fast\nDecoy, Damaged, Slow \n\nFriendly;\nAutonomous, Undamaged, Slow\nAutonomous, Undamaged, Fast\nAutonomous, Damaged, Slow\nDecoy, Undamaged, slow \n\n ","Speed,Status,Role,Direction,Craft","1,2,3,4,5"
61,integrated,superior,"Direction,Speed,Role,Craft,Status","0,2,1,4,3",verbal_report_textbox_phase3,This time I was less trusting of damaged crafts as I could not determine their speeds. \nOther than that I stuck to my chosen patterns.,"Status,Role,Direction,Speed,Craft","1,2,3,4,5"
62,integrated,superior,"Status,Speed,Direction,Craft,Role","0,3,4,1,2",verbal_report_textbox_phase2,I mainly looked at the directions and I suggested myself that this will show me the correct answear.,"Direction,Craft,Role,Speed,Status","1,2,3,4,5"
62,integrated,superior,"Status,Speed,Direction,Craft,Role","0,3,4,1,2",verbal_report_textbox_phase3,I was mainly looking at the directions to decide whether it was friendly or hostile.,"Direction,Status,Craft,Role,Speed","1,2,3,4,5"
63,integrated,superior,"Role,Direction,Craft,Status,Speed","3,0,2,1,4",verbal_report_textbox_phase2,Mostly off the damage status and it being or not a decoy.,"Status,Role,Craft,Speed,Direction","1,2,3,4,5"
63,integrated,superior,"Role,Direction,Craft,Status,Speed","3,0,2,1,4",verbal_report_textbox_phase3,"Mostly off the speed they were having, I got confused without the damage bar.","Speed,Craft,Role,Direction,Status","1,2,3,4,5"
64,integrated,superior,"Craft,Speed,Direction,Role,Status","0,2,4,1,3",verbal_report_textbox_phase2,"I tried to learn a routine from the practice phase, and then follow that through. It was certainly more difficult than I imagined though!","Craft,Role,Direction,Speed,Status","1,2,3,4,5"
64,integrated,superior,"Craft,Speed,Direction,Role,Status","0,2,4,1,3",verbal_report_textbox_phase3,"I based in one my priorities, which were automated or not, and the speed of the craft first of all","Role,Craft,Speed,Direction,Status","1,2,3,4,5"
65,integrated,superior,"Status,Speed,Direction,Craft,Role","0,1,4,3,2",verbal_report_textbox_phase2,"I decided on the how fast or slow the craft travel, the direction, the autonomous and whether it was damaged or not. It seem that the slow the craft the the hostile the craft was and the faster the craft the more friendly it was. ","Craft,Speed,Direction,Status,Role","1,2,3,4,5"
65,integrated,superior,"Status,Speed,Direction,Craft,Role","0,1,4,3,2",verbal_report_textbox_phase3,Since there was no speed to look at i decided on how autonomous the craft is followed by how damaged it is then the direction.,"Role,Status,Craft,Direction,Speed","1,2,3,4,5"
66,integrated,superior,"Speed,Status,Craft,Direction,Role","3,1,0,4,2",verbal_report_textbox_phase2,"if it was an airplane to the right it was friendly, to he left  hostile, submarines damaged were i think hostile but i had more difficulty","Role,Speed,Status,Craft,Direction","2,2,4,5,5"
66,integrated,superior,"Speed,Status,Craft,Direction,Role","3,1,0,4,2",verbal_report_textbox_phase3,i couldn't yet figure out the autonomous/decoy pattern but usually airplanes to the right were friendly and to the left hostile. if submarines were slow to the righ they were friendly and i guessed  fast and to the left ususually hostile,"Role,Speed,Direction,Craft,Status","1,4,4,5,5"
67,integrated,superior,"Direction,Role,Craft,Speed,Status","2,0,3,4,1",verbal_report_textbox_phase2,"I categorized most damaged airplane as hostile, and any craft that was both fast and had a decoy role as hostile as well.","Role,Speed,Status,Craft,Direction","1,2,3,4,5"
67,integrated,superior,"Direction,Role,Craft,Speed,Status","2,0,3,4,1",verbal_report_textbox_phase3,I categorized fast decoy aircraft as hostile,"Speed,Role,Craft,Direction,Status","1,2,3,4,5"
68,integrated,superior,"Speed,Direction,Craft,Status,Role","4,3,1,2,0",verbal_report_textbox_phase2,"I would typically assume that if the craft was not damaged then it was friendly. if it was damaged and fast it was hostile. if it was damaged and slow it was possibly friendly.  i had a slight feeling that turning left was more friendly than turning right, but that wasn't a set rule in my head. i was not really certain in some judgements though as i feel i hadn't concluded enough from the training\n\nas a note, i did mistake the decoy symbol as meaning it was not-autonomous, and had made some initial judgements on the basis of there being a \""""pilot\"""", though i believe the training   would still have adjusted my assumptions etc, especially as i the autonomous/decoy state wasn't considered as highly as others. thought it best to include the info though","Craft,Role,Direction,Status,Speed","1,2,3,5,5"
68,integrated,superior,"Speed,Direction,Craft,Status,Role","4,3,1,2,0",verbal_report_textbox_phase3,hostile only if fast and going left. everything else was friendly. not sure why really. wasn't feeling confident at all in my judgements so made a rule to follow for myself,"Direction,Speed,Craft,Role,Status","1,2,5,5,5"
69,integrated,superior,"Direction,Status,Role,Craft,Speed","3,2,0,4,1",verbal_report_textbox_phase2,"I looked if the craft was either damaged, fast or a decoy. If 2 out of 3 of this elements were present, I classified it as hostile. Otherwise, it was friendly. I didn't consider shape or direction.","Status,Speed,Role,Direction,Craft","1,2,3,4,5"
69,integrated,superior,"Direction,Status,Role,Craft,Speed","3,2,0,4,1",verbal_report_textbox_phase3,"I looked if a craft was either damaged or a decoy. If these two criteria were met, I considered it hostile. Otherwise, it was a split chance 50/50.","Status,Role,Direction,Craft,Speed","1,2,3,4,5"
70,integrated,superior,"Role,Status,Speed,Direction,Craft","1,4,0,3,2",verbal_report_textbox_phase2,I tried to remember and figure out as many situations as possible from phase 1 and I saw I succeed more when realised the direction (unless it was just luck),"Direction,Role,Status,Speed,Craft","1,2,3,4,5"
70,integrated,superior,"Role,Status,Speed,Direction,Craft","1,4,0,3,2",verbal_report_textbox_phase3,"This time I had no direction to follow so I did my guesses considering the rest, but it's hard to say as I didn't have any feedback.","Role,Speed,Status,Craft,Direction","1,2,3,4,5"
71,integrated,superior,"Status,Role,Craft,Direction,Speed","1,2,3,0,4",verbal_report_textbox_phase2,The speed played a major part in my decision making,"Speed,Status,Role,Direction,Craft","1,2,3,4,5"
71,integrated,superior,"Status,Role,Craft,Direction,Speed","1,2,3,0,4",verbal_report_textbox_phase3,the speed was my major focus,"Speed,Direction,Role,Craft","1,2,3,4"
72,integrated,superior,"Craft,Speed,Status,Direction,Role","3,4,0,1,2",verbal_report_textbox_phase2,"a plane from the right that was slow, damaged and a decoy was hostile. Any other plane was friendly.\n\na submarine from the left, fast and autonomous was friendly, the rest were hostile.","Role,Status,Speed,Craft,Direction","2,3,4,5,5"
72,integrated,superior,"Craft,Speed,Status,Direction,Role","3,4,0,1,2",verbal_report_textbox_phase3,no idea,"",""
73,integrated,superior,"Speed,Direction,Craft,Role,Status","1,4,0,3,2",verbal_report_textbox_phase2,The craft facing down is the friendly craft. While the craft facing up is the hostile craft.,"Craft,Speed,Direction,Role,Status","1,2,3,4,5"
73,integrated,superior,"Speed,Direction,Craft,Role,Status","1,4,0,3,2",verbal_report_textbox_phase3,Airplane is hostile while the submarine is friendly.,"Craft,Speed,Status,Direction,Role","1,2,3,4,5"
74,integrated,superior,"Craft,Direction,Status,Role,Speed","0,1,2,4,3",verbal_report_textbox_phase2,The friendly craft is the one facing up.,"Craft,Status,Direction,Speed,Role","1,2,3,4,5"
74,integrated,superior,"Craft,Direction,Status,Role,Speed","0,1,2,4,3",verbal_report_textbox_phase3,The submarine craft was friendly while the airplane was hostile was the hostile craft.,"Craft,Role,Status,Direction,Speed","1,2,3,4,5"
75,integrated,superior,"Status,Role,Direction,Speed,Craft","2,0,3,4,1",verbal_report_textbox_phase2,"","Speed,Role,Direction,Craft,Status","1,2,3,4,5"
75,integrated,superior,"Status,Role,Direction,Speed,Craft","2,0,3,4,1",verbal_report_textbox_phase3,"","Speed,Status,Craft,Role,Direction","1,2,3,4,5"
76,integrated,superior,"Craft,Direction,Speed,Status,Role","3,0,1,4,2",verbal_report_textbox_phase2,"If the craft was a damaged decoy and traveled fast, i considered it hostile.\n\nIf the craft moved to the left and was undamaged, no matter the speed and being autonomous or decoy, I tended to consider it friendly.\n\nFast undamaged crafts moving right tended to be considered hostile.\n\nSlow damaged crafts moving left were friendly.\n\n\n","Craft,Status,Speed,Role,Direction","1,2,3,4,5"
76,integrated,superior,"Craft,Direction,Speed,Status,Role","3,0,1,4,2",verbal_report_textbox_phase3,moving right considered almost all as hostile.\nmoving left as friendly.\nhigh speed damaged mostly hostile.\nleft high or low speed undamaged crafts as friendly.\n,"Status,Craft,Role,Speed,Direction","1,2,3,4,5"
77,integrated,superior,"Role,Status,Direction,Craft,Speed","3,2,0,1,4",verbal_report_textbox_phase2,"My decision was arrived at by observing the speed of the craft. Fast crafts were hostile and slow crafts are friendly. I noticed two exceptions. Fast, autonomous planes, going in the right direction are friendly. Slow, decoy ships going right are hostile.","Speed,Role,Craft,Status,Direction","1,2,3,4,5"
77,integrated,superior,"Role,Status,Direction,Craft,Speed","3,2,0,1,4",verbal_report_textbox_phase3,"The exceptions for the second task were the only ones i recalled with certainty. Slow , decoy, ship, going right is hostile, and fast, auto plane, going right is friendly. The rest were determined from memory recall.","Speed,Role,Craft,Status,Direction","1,2,3,4,5"
