participant_id,displayCondition,socialCondition,dimensionOrder,displayOrder,experiment_phase,response,rankOrder,orderedRanks
78,integrated,superior,"Role,Direction,Craft,Speed,Status","3,1,2,0,4",verbal_report_textbox_phase2,"I choose whether a craft was friendly or hostile based on the craft type. Most of airplanes were friendly while most of submarines were hostile, except from a few compinations of all characteristics where an airplane could be hostile and a submarine could be friendly.","Craft,Status,Role,Speed,Direction","1,2,3,4,5"
78,integrated,superior,"Role,Direction,Craft,Speed,Status","3,1,2,0,4",verbal_report_textbox_phase3,In this tank some characteristics were missing except from the craft type which were always available. This was the main option to choose where a craft was friendly or hostile. Almost all of airplanes were friendly and all submarines were hostile except from a few combinations of the rest characteristics which they could make an airplane hostile and a submarine friendly. In this task some of the rest characteristics were missing so from the craft type and the given characteristics I decided the most possible option.,"Craft,Status,Speed,Role,Direction","1,2,3,4,5"
79,integrated,superior,"Direction,Craft,Role,Speed,Status","0,3,4,2,1",verbal_report_textbox_phase2,"Based on the part of the experiment in which I received feedback. I got a sense from the prior distribution, which dictated that most crafts were friendly and I believe I correctly identified two cases (which if I'm not mistaken occured more often) in which the craft was hostile. I could not identify a pattern per se so I had to extrapolate based on that alone. I cross checked these two patterns and decided that an important factor was damaged/undamaged because in both cases the healthbar was full. Other than that, unless I'm wrong the type of craft played an important part (in that very part I'd say out of the hostile fleet, most were submarines - yet I did not allow this observation to play a greater role since it was conditioned on the fact that the craft was hostile which was not the case for most crafts) . ","Craft,Status,Speed,Direction,Role","1,2,3,4,5"
79,integrated,superior,"Direction,Craft,Role,Speed,Status","0,3,4,2,1",verbal_report_textbox_phase3,"I tried to apply my pre-existing knowledge. I do recall the class of a (type, direction, health, speeed, [autonomus/decoy]) combination so every time it appeared I was \""""certain\"""" of the correct class since I assumed it was uniquely determined by the triplet I had access to (and by uniquely determined I mean I'm better off predicting hostile every time). Otherwise, I tried to create a consistent set of rules but there was much randomness involved.","Craft,Status,Direction,Speed,Role","1,2,3,4,5"
80,separated,superior,"Speed,Role,Status,Direction,Craft","3,1,0,4,2",verbal_report_textbox_phase2,"Mostly i was looking if it was a decoy. Then i would look on the damage, then their direction","Role,Status,Craft,Direction,Speed","1,1,2,4,5"
80,separated,superior,"Speed,Role,Status,Direction,Craft","3,1,0,4,2",verbal_report_textbox_phase3,"Still i was looking if thats a decoy, then the damage staus. This time i was paying attencion to if its a airplane or a submarine","Role,Status,Speed,Craft,Direction","1,2,3,4,5"
81,separated,superior,"Status,Craft,Speed,Direction,Role","3,0,1,2,4",verbal_report_textbox_phase2,"If he had been autonomous and had not damaged, surely he was hostile.","Role,Status,Speed,Craft,Direction","1,2,3,4,5"
81,separated,superior,"Status,Craft,Speed,Direction,Role","3,0,1,2,4",verbal_report_textbox_phase3,"\nIf it was fast, it was hostile.","Speed,Status,Craft,Direction,Role","1,2,3,4,5"
82,separated,superior,"Speed,Status,Direction,Role,Craft","0,2,3,4,1",verbal_report_textbox_phase2,"Looking at speed and direction mainly. Using the training examples, the 'correct' answers seemed to stem from from looking at the two boxes the most so I went with those. ","Direction,Speed,Role,Craft,Status","1,2,3,4,5"
82,separated,superior,"Speed,Status,Direction,Role,Craft","0,2,3,4,1",verbal_report_textbox_phase3,By using the decoy/autonomous status and the speed. Then checking the craft as well. ,"Role,Speed,Craft,Status,Direction","1,2,3,4,5"
83,separated,superior,"Speed,Direction,Status,Craft,Role","0,4,3,2,1",verbal_report_textbox_phase2,"I was looking at their status about damage (damaged/undamaged). If it was damaged it was hostile, but if it was undamaged (green) it was friendly, except from the cases where it was going to the right and its speed was 60; then it was hostile.","Status,Direction,Speed,Craft,Role","1,2,3,4,5"
83,separated,superior,"Speed,Direction,Status,Craft,Role","0,4,3,2,1",verbal_report_textbox_phase3,"This time, since no data were available for speed (this is why I ranked it 5th) I was mainly based on the status about damaged/undamaged, as well as on whether it went left or right. I was not confident about my answers when it was green and was going right, because I didn't know its speed in order to categorize it. ","Status,Direction,Craft,Role,Speed","1,2,3,4,5"
84,separated,superior,"Status,Craft,Direction,Role,Speed","1,3,0,4,2",verbal_report_textbox_phase2,"I saw most important feature is their speed, hostile crafts were moving faster than friendly ones not always but in majority.","Speed,Status,Direction,Craft,Role","1,3,3,5,5"
84,separated,superior,"Status,Craft,Direction,Role,Speed","1,3,0,4,2",verbal_report_textbox_phase3,Majority of friendly crafts were slower than enemy crafts\n,"Speed,Status,Direction,Craft,Role","1,2,3,5,5"
85,separated,superior,"Speed,Direction,Role,Craft,Status","0,2,1,4,3",verbal_report_textbox_phase2,I first looked if the craft was autonoumous or decay.Then i would look at the damage and speed. If its a demaged and moving too fast or slow i would considered it a hostile. If it is undamaged and moving too fast i would consider it a hostile. Slow and undamged not a hostile.,"Status,Role,Speed,Craft,Direction","1,2,3,4,5"
85,separated,superior,"Speed,Direction,Role,Craft,Status","0,2,1,4,3",verbal_report_textbox_phase3,I first looked at damaged then the decoy then type of craft. If it was damaged and a decoy it is hostile. If it was a decoy it is hostile. the type of craft was irrelevent as the speed was not available,"Status,Role,Craft,Direction,Speed","1,2,3,4,5"
86,separated,superior,"Status,Craft,Speed,Direction,Role","0,3,1,4,2",verbal_report_textbox_phase2,"Basically i felt like the key parameter was whether the craft was autonomous or a decoy; I felt the study was just about it, with a \""""decoy\"""" parameter, the status of the craft (damaged or undamaged): the green light pushes me towards a friendly craft, viceversa the red one. I felt the other parameters (speed, vehicle or direction) didn't matter in the choice.","Role,Status,Craft,Speed,Direction","1,3,5,5,5"
86,separated,superior,"Status,Craft,Speed,Direction,Role","0,3,1,4,2",verbal_report_textbox_phase3,"Without the key parameter (the role), i based basically on the status( decoy or autonomous). In the beginning i was thinking about the type of the craft too, but then i realized maybe the only factor which was involved was the status, so i focused on that.\n","Role,Status,Craft,Speed,Direction","1,1,5,5,5"
87,separated,superior,"Speed,Status,Craft,Direction,Role","4,0,3,1,2",verbal_report_textbox_phase2,damaged was hostile while undamaged was friendly,"Status,Craft,Role,Speed,Direction","1,2,3,4,5"
87,separated,superior,"Speed,Status,Craft,Direction,Role","4,0,3,1,2",verbal_report_textbox_phase3,hostile no info whether it is damaged or not,"Status,Role,Craft,Speed,Direction","1,2,3,4,5"
88,separated,superior,"Direction,Status,Role,Craft,Speed","3,0,2,4,1",verbal_report_textbox_phase2,I assumed that faster aircraft and autonomous ones would be more friendly as the hostility would be over in a quicker period. I had to justify whether the speed was more important or the damage it created,"Speed,Role,Status,Direction,Craft","1,2,3,4,5"
88,separated,superior,"Direction,Status,Role,Craft,Speed","3,0,2,4,1",verbal_report_textbox_phase3,It was more difficult to decide this time but I based it more this time on whether the task was decoy or autonomous and its damage level,"Role,Status,Direction,Craft,Speed","1,2,3,4,5"
89,separated,superior,"Speed,Role,Craft,Status,Direction","4,1,0,2,3",verbal_report_textbox_phase2,"First i try to look if it's a Airplane or Submarine, then the speed, then if it's decoy or not.","Direction,Status,Speed,Craft,Role","1,3,3,4,4"
89,separated,superior,"Speed,Role,Craft,Status,Direction","4,1,0,2,3",verbal_report_textbox_phase3,"First i look if it's an airplane or submarine, then the speed and if it's Decoy or not.","Status,Speed,Direction,Craft,Role","2,2,2,4,4"
90,separated,superior,"Direction,Status,Role,Craft,Speed","1,2,3,4,0",verbal_report_textbox_phase2,"A submarine coming from any direction, as a decoy or autonomous that was fast was friendly and one that was slow was hostile. And vice versa for the plane (fast planes were hostile no matter the condition or direction","Speed,Craft,Status,Role,Direction","1,2,3,4,5"
90,separated,superior,"Direction,Status,Role,Craft,Speed","1,2,3,4,0",verbal_report_textbox_phase3,"Autonomous in either condition meant hostile. Decoy in undamaged was friendly. Unsure about decoy and damaged, I thought it might have been friendly too","Role,Status,Direction,Craft,Speed","1,2,3,4,5"
91,separated,superior,"Direction,Role,Speed,Status,Craft","4,0,3,2,1",verbal_report_textbox_phase2,First I looked at the speed then if it was an aircraft or a submarine. Finally if it was a decoy. I considered the damage if it was an aircraft. I have not considered the direction ,"Speed,Craft,Role,Status,Direction","1,2,3,4,5"
91,separated,superior,"Direction,Role,Speed,Status,Craft","4,0,3,2,1",verbal_report_textbox_phase3,"Again I looked at the speed, then if it was a plane or a submarine. Finally if it were a lure. I considered the damage if it were a plane. I did not consider the management because the data was not available ","Speed,Craft,Role,Status,Direction","1,2,3,4,5"
92,separated,superior,"Direction,Craft,Status,Speed,Role","4,3,0,1,2",verbal_report_textbox_phase2,"If they were going at a slow speed towards right, I assumed they were friendly. Furthermore when they were decoys, no matter what direction they were headed to, if their speed were slow, I'd assume they were friendly. When they were going at full speed or at slow speed and they weren't decoys, I assumed they were hostile. ","Speed,Role,Direction,Status,Craft","1,2,2,3,4"
92,separated,superior,"Direction,Craft,Status,Speed,Role","4,3,0,1,2",verbal_report_textbox_phase3,"Since it was impossible for me to see their roles, I based my choices on their speed and their direction and the their health. If they were headed towards right at a low speed they were friendly. If they were going towards right at high speed but their health was low, I'd consider them friendly otherwise hostile. If they were headed towards left at a low speed and damaged, I'd consider them friendly while in all the other cases they were considered hostile.","Speed,Direction,Status,Craft,Role","1,1,2,5,5"
93,separated,superior,"Direction,Status,Role,Speed,Craft","1,2,4,3,0",verbal_report_textbox_phase2,I tended to believe that an undamaged autonomous craft travelling at speed from either direction was suspicious and therefore felt was potentially hostile as I did not see the need for it to be travelling at speed.\n\nAnything travelling at low speed I was more inclined to believe was less of a threatening scenario,"Speed,Status,Role,Direction,Craft","1,2,3,4,5"
93,separated,superior,"Direction,Status,Role,Speed,Craft","1,2,4,3,0",verbal_report_textbox_phase3,employed the same reasoning as before because direction really played no part in my thoughts previously and the fact it had been removed therefore did not influence my decision making,"Speed,Status,Role,Craft,Direction","1,2,3,4,5"
94,separated,superior,"Direction,Speed,Status,Craft,Role","3,0,1,4,2",verbal_report_textbox_phase2,"I noticed at the training part of the study that the ones with the faster speed were mostly hostile so I tried to consider the other features as well, such as direction and guess everytime whether they were friendly or hostile.","Speed,Role,Direction,Craft,Status","1,2,3,4,5"
94,separated,superior,"Direction,Speed,Status,Craft,Role","3,0,1,4,2",verbal_report_textbox_phase3,I also noticed at the first part of the study that the decoys were hostile most of the times so when the speed wasn't available in this task I tried to guess if they were friendly or not by looking if they were autonomous or decoy.,"Speed,Role,Direction,Status,Craft","1,2,3,4,5"
95,separated,superior,"Craft,Direction,Speed,Role,Status","4,0,3,2,1",verbal_report_textbox_phase2,"mainly based on which craft it was, airplanes being hostile and submarines being friendly. ","Craft,Speed,Role,Status,Direction","1,2,3,4,5"
95,separated,superior,"Craft,Direction,Speed,Role,Status","4,0,3,2,1",verbal_report_textbox_phase3,i struggled as initially i had only figured out the crafts,"Role,Direction,Speed,Status,Craft","1,2,3,4,5"
96,separated,superior,"Direction,Role,Status,Speed,Craft","2,3,0,4,1",verbal_report_textbox_phase2,"I thought - but I am not sure if it was the right answer - that the «good« factors that determined Friebdly were being an airplane, autonomous, undamaged, going left and fast. So if a vessel had 3 or more of these characteristics I classified it as Friendly. I really didn't give more importance to one or other feature, just checked if there were 3 or more present. That's the idea I got from the training phase.","Status,Role,Craft,Speed,Direction","1,2,3,4,5"
96,separated,superior,"Direction,Role,Status,Speed,Craft","2,3,0,4,1",verbal_report_textbox_phase3,"Again, I assumed that the «good» characteristics were Airplane, Autonomous, Undamaged and Fast (direction was not available). So if 3 or more of these were present, I chose Friendly. If 3 or more of the «bad» characteristics were present, I chose Enemy. If there were 2 of each, I opted for Enemy, because you can't take that risk in war times :-)","Status,Craft,Role,Speed,Direction","1,2,3,4,5"
97,separated,superior,"Status,Craft,Direction,Speed,Role","1,2,0,4,3",verbal_report_textbox_phase2,I first checked if it was autonomous or decoy because decoys tended to be more hostile. I then checked the direction cause typically crafts going to the right (especially decoys) tend to be hostile no matter the speed or whether they were damaged or not. Then I checked the speed.,"Role,Direction,Speed,Status,Craft","1,2,3,4,5"
97,separated,superior,"Status,Craft,Direction,Speed,Role","1,2,0,4,3",verbal_report_textbox_phase3,I first checked the direction and then the speed and whether it was damaged or not. The autonomous/decoy factor was very important for me on the first test so now that it was missing I was a bit lost.,"Direction,Speed,Status,Craft,Role","1,2,3,4,5"
98,separated,superior,"Status,Role,Speed,Craft,Direction","4,0,2,1,3",verbal_report_textbox_phase2,The craft that was fast and damaged was hostile.\nThe craft that was slow and damaged was friendly.\nThe craft that was fast and undamaged was hostile.\nThe craft that was slow and undamaged was hostile. \nSometimes I also checked if the craft was decoy or auto.\nThe craft that was decoy was friendly.\nThe craft that was auto was hostile.,"Speed,Status,Role,Craft,Direction","1,2,3,4,5"
98,separated,superior,"Status,Role,Speed,Craft,Direction","4,0,2,1,3",verbal_report_textbox_phase3,Crafts that were decoy were friendly.\nCrafts that were auto were hostile.,"Role,Status,Craft,Direction,Speed","1,2,3,4,5"
99,separated,superior,"Status,Craft,Speed,Role,Direction","3,2,0,4,1",verbal_report_textbox_phase2,"I looked at whether it was an autonomous or decoy submarine or airplane going left or right, trying to focus on where each side's home base could be, and then if a craft was damaged and going at low speeds, it was probably going to get repaired, but I did get confused from time to time.","Role,Craft,Direction,Status,Speed","1,2,3,4,5"
99,separated,superior,"Status,Craft,Speed,Role,Direction","3,2,0,4,1",verbal_report_textbox_phase3,"I took damage as the base, and decided based on if a craft was an airplane or a submarine. If it was a damaged submarine going to the left, it was going to the base to get repaired, if it was undamaged going in the same direction, it was going to attack. It didn't matter if it was autonomous or a decoy, because the damage would have stopped it anyway. I'm not sure what I based my decision of which side had the hostile submarine base and the hostile airplane base, but I probably thought I made the right decision when the question whether or not I thought I made the right decision did not pop up. That probably was a pretty silly starting point and it might have switched the whole thing up and I got nothing right (I didn't really catch on in the first round where you told me the right and wrong answers, I think -- I didn't know what to look for, if I started again, I would probably do better). But yes, I mostly took the damage, the craft and the direction into account.","Craft,Direction,Status,Speed,Role","1,2,3,4,5"
100,separated,superior,"Direction,Speed,Role,Craft,Status","3,1,2,4,0",verbal_report_textbox_phase2,"If direction was left or right and undamaged, it was firendly. If damaged it was hostile","Status,Direction,Craft,Role,Speed","1,2,3,4,5"
100,separated,superior,"Direction,Speed,Role,Craft,Status","3,1,2,4,0",verbal_report_textbox_phase3,"Undamaged was friendly, damaged hostile","Status,Craft,Role,Speed,Direction","1,5,5,5,5"
101,separated,superior,"Direction,Craft,Role,Speed,Status","1,2,4,3,0",verbal_report_textbox_phase2,"If it was an damaged decoy I recognised it as an enemy becasue it would be an easy target. So it's ideal for an enemy decoy. Every other decoy  besides the slow moving, dameged decoy were friendly.\nAutonomous aircraft and submarines were mostly hostile.\nIf it was slow moving and damged it or it was following other moving object was friendly and if not it was hostile.\nIt was my simple rules of defining which is which but i may have made some mistakes.\n","Role,Status,Speed,Craft,Direction","1,2,3,4,5"
101,separated,superior,"Direction,Craft,Role,Speed,Status","1,2,4,3,0",verbal_report_textbox_phase3,I changed my point of view in this experiment\n\nThe slow moving damaged objects only if not followed by any were identified as friendly. Any damaged and slow moving were identified as hostile.\n\nDamaged Aircrafts if not followed by anything were friendly but those followed and slow moving were hostile. \nThe fast moving damaged aircrafts following submarine or aircraft were friendly.\n\nSubmarines that were damged and slow moving if not followed were friendly but if they were shown as a first object they were identified as enemy decoy.\n\nPlanes were friendly if following any damaged submarine or aircraft.,"Speed,Status,Direction,Craft,Role","1,2,3,4,5"
102,separated,superior,"Speed,Direction,Status,Craft,Role","3,0,1,2,4",verbal_report_textbox_phase2,"Firstly speed, 60 was more likely to be hostile. 60 was only likely to be friendly if undamaged. Auto was friendly if going left. Submarine or airplane didn't seem to change much.","Speed,Craft,Role,Status,Direction","1,2,3,4,5"
102,separated,superior,"Speed,Direction,Status,Craft,Role","3,0,1,2,4",verbal_report_textbox_phase3,"Left and undamaged was most likely to be friendly, it was hard without the speed. ","Speed,Direction,Status,Craft,Role","1,2,3,4,5"
103,separated,superior,"Craft,Direction,Status,Speed,Role","1,2,3,0,4",verbal_report_textbox_phase2,"sometimes it was red and it had a low speed which meant it was friendly and sometimes it was green and it had a high speed which meant it was hostile, also the arrow's direction indicated the situation ","Direction,Speed,Status,Role,Craft","1,2,3,4,5"
103,separated,superior,"Craft,Direction,Status,Speed,Role","1,2,3,0,4",verbal_report_textbox_phase3,it was depending on the speed and the direction of the arrow,"Direction,Speed,Status,Role,Craft","1,2,3,4,5"
104,separated,superior,"Craft,Direction,Status,Speed,Role","3,0,4,2,1",verbal_report_textbox_phase2,"i was trying to establish it based on the direction and speed that it were going, taking under thinking if it is damaged or not. i try to figure it out if it persist to attack even when it is damaged or if its returning to the base from the battlefield","Direction,Speed,Status,Role,Craft","1,2,3,4,5"
104,separated,superior,"Craft,Direction,Status,Speed,Role","3,0,4,2,1",verbal_report_textbox_phase3,based on the categories from the previous page i was trying to establish if it attacking or running for the battlefield,"Direction,Speed,Status,Role,Craft","1,2,3,4,5"
105,separated,superior,"Craft,Direction,Role,Status,Speed","1,3,4,2,0",verbal_report_textbox_phase2,"I realised a high proportion of the damaged craft were hostile whilst a high proportion of the undamaged craft were friendly. I tried to make further deductions in Phase 1 and see the role played by other factors such as decoy/autonomous, but I quickly got 2 wrong and didn't want to risk proceeding to phase 2 so I played safely thereafter. However, I felt sure there was a reasonable role played by speed and decoy/autonomous.\n","Status,Speed,Role,Craft,Direction","1,2,3,4,5"
105,separated,superior,"Craft,Direction,Role,Status,Speed","1,3,4,2,0",verbal_report_textbox_phase3,"Same as the task before. However, i should add that i based the confidence i attached to my decisions according to the speed of the craft. For example, fast and damaged i was quite certain was a hostile craft, whilst slow and damaged/undamaged only gave me a confidence slightly above 60%.","Status,Speed,Role,Craft,Direction","1,2,3,4,5"
106,separated,superior,"Craft,Direction,Role,Speed,Status","4,1,2,3,0",verbal_report_textbox_phase2,"I just had a feeling that I can't explain how. I just felt that certain craft was friendly or hostile. If craft was damaged and was going fast, then it probably was a hostile craft. If craft was healthy, wasn't a decoy and was going slow, then it probably was a friendly craft.","Craft,Direction,Role,Speed,Status","1,2,3,4,5"
106,separated,superior,"Craft,Direction,Role,Speed,Status","4,1,2,3,0",verbal_report_textbox_phase3,I was looking mainly on speed and damage. ,"Craft,Role,Direction,Speed,Status","1,1,2,4,5"
107,separated,superior,"Craft,Direction,Status,Role,Speed","1,4,2,0,3",verbal_report_textbox_phase2,"Most of the times submarines where friendly and airplanes hostile. But when the submarine was slow, damaged, moving to the right and automated or decoy all together it was hostille. Also when the airplane was fast, damaged or undamaged, moving to the right and automated altogether it was friendly.","Craft,Speed,Status,Role,Direction","1,2,3,4,5"
107,separated,superior,"Craft,Direction,Status,Role,Speed","1,4,2,0,3",verbal_report_textbox_phase3,when it was fast with right direction it was hostille but slow with left diretion was friendly,"Craft,Speed,Role,Status,Direction","1,2,3,4,5"
108,separated,superior,"Craft,Speed,Status,Role,Direction","4,0,1,3,2",verbal_report_textbox_phase2,"I tried to memorize patterns, at first only with type of possible threat (plane/ submarine) and whether it was autonomous or a decoy, then I added the speed but I was still failing some so I added the \""""health\""""(damaged/ undamaged).\nI never tried to memorize the direction.\nThen there were some patterns like if it was a plane and a decoy, it was automatically hostile or if it was a plane autonomous undamaged it was hostile.\nOf course there were some patterns that I couldn't memorize, that's why I'm not so confident in some of my answers, but there are many that I'm sure.","Craft,Role,Speed,Status,Direction","1,2,3,4,5"
108,separated,superior,"Craft,Speed,Status,Role,Direction","4,0,1,3,2",verbal_report_textbox_phase3,"I honestly had no idea, if was at a speed of 60 and undamaged I considered friendly, everything else was hostile","Craft,Role,Speed,Status,Direction","1,2,3,4,5"
109,separated,superior,"Role,Status,Craft,Speed,Direction","3,4,0,1,2",verbal_report_textbox_phase2,"just an impression really. I couldn't seem to reach a set of hard-and-fast rules - that's probably true for a genuinely wartime situation though.\n\nAnything underwater seemed hostile, especially fast and autonomous.\n\nIn the air, anything slow looked friendly (possibly a search helicopter?) Anything fast and autonomous mostly treated as hostile.","Craft,Speed,Direction,Status,Role","1,2,3,4,5"
109,separated,superior,"Role,Status,Craft,Speed,Direction","3,4,0,1,2",verbal_report_textbox_phase3,"Anything underwater, fast or slow, considered hostile.\n\nAnything aerial and slow, classed as friendly.\n\nAnything aerial, fast and heading to the right classed friendly.\n\nAnything aerial, fast and heading left classed as hostile.","Craft,Speed,Direction,Role,Status","1,2,3,4,5"
110,separated,superior,"Status,Craft,Speed,Direction,Role","4,2,1,0,3",verbal_report_textbox_phase2,"I thought that the friendly one was the one with 3 friendly charactericstics and 2 or less wrong characterictics. I was first looking at the color (damaged/undamaged) because my eyes were staring at this one, and then at the speed. I counted the right ones.","Craft,Direction,Role,Status,Speed","1,2,3,4,5"
110,separated,superior,"Status,Craft,Speed,Direction,Role","4,2,1,0,3",verbal_report_textbox_phase3,the friendly one was the one with the characteristic i thought that was more important than the others ,"Direction,Craft,Role,Status,Speed","1,2,3,4,5"
